{"schema_version":"editing-timeline/v1","output_profile":{"id":"cookies-editing-vertical-v1","width":720,"height":1280,"frame_rate":30,"sample_rate":48000},"duration_ms":10000,"tracks":[{"id":"primary-video","role":"primary_video","clips":[{"id":"preroll","asset_ref":{"asset_id":"asset_short_drama_preroll","version":1},"timeline_start_ms":0,"timeline_end_ms":5000,"source_in_ms":0,"source_out_ms":5000},{"id":"source","asset_ref":{"asset_id":"asset_source","version":3},"timeline_start_ms":5000,"timeline_end_ms":10000,"source_in_ms":500,"source_out_ms":5500}]},{"id":"caption","role":"caption","clips":[{"id":"caption-hook","timeline_start_ms":0,"timeline_end_ms":2500,"text":"十秒短剧前贴"}]}]}
