{"schema_version":"editing-timeline/v1","output_profile":{"id":"cookies-editing-vertical-v1","width":720,"height":1280,"frame_rate":30,"sample_rate":48000},"duration_ms":20000,"tracks":[{"id":"primary-video","role":"primary_video","clips":[{"id":"hook","asset_ref":{"asset_id":"asset_hook","version":1},"timeline_start_ms":0,"timeline_end_ms":4000,"source_in_ms":0,"source_out_ms":4000},{"id":"main","asset_ref":{"asset_id":"asset_main","version":2},"timeline_start_ms":4000,"timeline_end_ms":20000,"source_in_ms":10000,"source_out_ms":26000}]},{"id":"caption","role":"caption","clips":[{"id":"caption-1","timeline_start_ms":0,"timeline_end_ms":2000,"text":"先给出结果"},{"id":"caption-2","timeline_start_ms":4000,"timeline_end_ms":7000,"text":"再展示原片"}]}]}
