{"schema_version":"editing-timeline/v1","output_profile":{"id":"cookies-editing-vertical-v1","width":720,"height":1280,"frame_rate":30,"sample_rate":48000},"duration_ms":15000,"tracks":[{"id":"primary-video","role":"primary_video","clips":[{"id":"source-trim","asset_ref":{"asset_id":"asset_source","version":2},"timeline_start_ms":0,"timeline_end_ms":15000,"source_in_ms":5000,"source_out_ms":20000}]}]}
