{"schema_version":"editing-timeline/v1","output_profile":{"id":"cookies-editing-vertical-v1","width":720,"height":1280,"frame_rate":30,"sample_rate":48000},"duration_ms":15000,"tracks":[{"id":"primary-video","role":"primary_video","clips":[{"id":"visual","asset_ref":{"asset_id":"asset_visual","version":1},"timeline_start_ms":0,"timeline_end_ms":15000,"source_in_ms":0,"source_out_ms":15000}]},{"id":"caption","role":"caption","clips":[{"id":"caption-1","timeline_start_ms":0,"timeline_end_ms":3500,"text":"一句口播"}]},{"id":"voiceover","role":"voiceover","clips":[{"id":"voice-1","asset_ref":{"asset_id":"asset_voice","version":1},"timeline_start_ms":0,"timeline_end_ms":3500,"source_in_ms":0,"source_out_ms":3500}]},{"id":"music","role":"music","clips":[{"id":"music-1","asset_ref":{"asset_id":"asset_music","version":1},"timeline_start_ms":0,"timeline_end_ms":15000,"source_in_ms":0,"source_out_ms":15000,"gain_db":-12}]}]}
