{"schema_version":"editing-timeline/v1","output_profile":{"id":"cookies-editing-vertical-v1","width":720,"height":1280,"frame_rate":30,"sample_rate":48000},"duration_ms":30000,"tracks":[{"id":"primary-video","role":"primary_video","clips":[{"id":"source-long-trim","asset_ref":{"asset_id":"asset_long_source","version":2},"timeline_start_ms":0,"timeline_end_ms":30000,"source_in_ms":30000,"source_out_ms":60000}]},{"id":"music","role":"music","clips":[{"id":"bed","asset_ref":{"asset_id":"asset_music","version":1},"timeline_start_ms":0,"timeline_end_ms":30000,"source_in_ms":20000,"source_out_ms":50000,"gain_db":-15}]}]}
