{"schema_version":"editing-timeline/v1","output_profile":{"id":"cookies-editing-vertical-v1","width":720,"height":1280,"frame_rate":30,"sample_rate":48000},"duration_ms":30000,"tracks":[{"id":"primary-video","role":"primary_video","clips":[{"id":"opening","asset_ref":{"asset_id":"asset_opening","version":1},"timeline_start_ms":0,"timeline_end_ms":6000,"source_in_ms":0,"source_out_ms":6000},{"id":"proof","asset_ref":{"asset_id":"asset_proof","version":1},"timeline_start_ms":6000,"timeline_end_ms":18000,"source_in_ms":1000,"source_out_ms":13000},{"id":"cta","asset_ref":{"asset_id":"asset_cta","version":1},"timeline_start_ms":18000,"timeline_end_ms":30000,"source_in_ms":0,"source_out_ms":12000}]}]}
