{"schema_version":"editing-timeline/v1","output_profile":{"id":"cookies-editing-vertical-v1","width":720,"height":1280,"frame_rate":30,"sample_rate":48000},"duration_ms":15000,"tracks":[{"id":"primary-video","role":"primary_video","clips":[{"id":"visual","asset_ref":{"asset_id":"asset_visual","version":5},"timeline_start_ms":0,"timeline_end_ms":15000,"source_in_ms":0,"source_out_ms":15000}]},{"id":"caption","role":"caption","clips":[{"id":"caption-1","timeline_start_ms":0,"timeline_end_ms":2000,"text":"第一句"},{"id":"caption-2","timeline_start_ms":3000,"timeline_end_ms":5000,"text":"第二句"},{"id":"caption-3","timeline_start_ms":10000,"timeline_end_ms":14000,"text":"第三句"}]}]}
