{"schema_version":"editing-timeline/v1","output_profile":{"id":"cookies-editing-vertical-v1","width":720,"height":1280,"frame_rate":30,"sample_rate":48000},"duration_ms":15000,"tracks":[{"id":"primary-video","role":"primary_video","clips":[{"id":"visual","asset_ref":{"asset_id":"asset_visual","version":1},"timeline_start_ms":0,"timeline_end_ms":15000,"source_in_ms":0,"source_out_ms":15000}]},{"id":"sfx","role":"sfx","clips":[{"id":"hit","asset_ref":{"asset_id":"asset_hit","version":1},"timeline_start_ms":5000,"timeline_end_ms":6000,"source_in_ms":200,"source_out_ms":1200,"gain_db":-3}]}]}
