{
  "schema_version": "editing-timeline/v1",
  "output_profile": {
    "id": "cookies-editing-vertical-v1",
    "width": 720,
    "height": 1280,
    "frame_rate": 30,
    "sample_rate": 48000
  },
  "duration_ms": 20000,
  "tracks": [
    {
      "id": "primary-video",
      "role": "primary_video",
      "clips": [
        {
          "id": "short-drama-preroll",
          "asset_ref": { "asset_id": "asset_short_drama_preroll", "version": 1 },
          "timeline_start_ms": 0,
          "timeline_end_ms": 6000,
          "source_in_ms": 0,
          "source_out_ms": 6000
        },
        {
          "id": "uploaded-source-video",
          "asset_ref": { "asset_id": "asset_uploaded_source", "version": 3 },
          "timeline_start_ms": 6000,
          "timeline_end_ms": 20000,
          "source_in_ms": 2000,
          "source_out_ms": 16000
        }
      ]
    },
    {
      "id": "captions",
      "role": "caption",
      "clips": [
        {
          "id": "caption-hook",
          "timeline_start_ms": 0,
          "timeline_end_ms": 2600,
          "text": "先看 6 秒前贴"
        }
      ]
    },
    {
      "id": "music",
      "role": "music",
      "clips": [
        {
          "id": "music-bed",
          "asset_ref": { "asset_id": "asset_music_bed", "version": 1 },
          "timeline_start_ms": 0,
          "timeline_end_ms": 20000,
          "source_in_ms": 1000,
          "source_out_ms": 21000,
          "gain_db": -12,
          "loop": true
        }
      ]
    }
  ]
}
