{"schema_version":"editing-timeline/v1","output_profile":{"id":"cookies-editing-vertical-v1","width":720,"height":1280,"frame_rate":30,"sample_rate":48000},"duration_ms":20000,"tracks":[{"id":"primary-video","role":"primary_video","clips":[{"id":"preroll","asset_ref":{"asset_id":"asset_preroll","version":1},"timeline_start_ms":0,"timeline_end_ms":5000,"source_in_ms":0,"source_out_ms":5000},{"id":"source","asset_ref":{"asset_id":"asset_source","version":1},"timeline_start_ms":5000,"timeline_end_ms":20000,"source_in_ms":0,"source_out_ms":15000}]},{"id":"music","role":"music","clips":[{"id":"music-offset","asset_ref":{"asset_id":"asset_music","version":4},"timeline_start_ms":0,"timeline_end_ms":20000,"source_in_ms":1200,"source_out_ms":21200,"gain_db":-10,"loop":true}]}]}
